{
  "manifestVersion": "marshal-operator-closure-matrix/v1",
  "freshness": {
    "taskId": "TASK-ID",
    "runId": "RUN-ID",
    "attemptId": "ATTEMPT-ID",
    "sourceHead": "0000000000000000000000000000000000000000",
    "reviewRound": 1,
    "specDigest": "sha256:0000000000000000000000000000000000000000000000000000000000000000",
    "verificationDigest": "sha256:0000000000000000000000000000000000000000000000000000000000000000",
    "artifactManifestDigest": "sha256:0000000000000000000000000000000000000000000000000000000000000000",
    "evidenceDigest": "sha256:0000000000000000000000000000000000000000000000000000000000000000",
    "reviewPacketDigest": "sha256:0000000000000000000000000000000000000000000000000000000000000000",
    "snapshotDigest": "sha256:0000000000000000000000000000000000000000000000000000000000000000",
    "diffDigest": "sha256:0000000000000000000000000000000000000000000000000000000000000000",
    "candidateDigest": "sha256:0000000000000000000000000000000000000000000000000000000000000000",
    "fingerprintDigest": "sha256:0000000000000000000000000000000000000000000000000000000000000000"
  },
  "findings": [
    {
      "id": "F-000000000000000000000000",
      "severity": "P1",
      "title": "替换为精确标题",
      "classification": "newly-discovered",
      "disposition": "blocking-rework",
      "domainKey": "DOMAIN-ID",
      "ruleId": "RULE-ID",
      "outcomeKey": "O-000000000000000000000000",
      "subject": "stable-subject",
      "location": { "kind": "source", "locator": "path/to/file.go", "line": 1 },
      "observableDefect": {
        "kind": "behavior",
        "observedFacts": ["填写可机械观察的现状"],
        "expectedFacts": ["填写封闭且可证伪的预期"],
        "evidenceRefs": [{ "kind": "gate", "id": "GATE-ID" }]
      },
      "requiredOutcome": {
        "kind": "observable-behavior",
        "assertions": [
          { "subject": "observable", "operator": "equals", "expected": ["exact-value"] }
        ],
        "verificationRefs": [{ "kind": "gate", "id": "GATE-ID" }],
        "negativeFixtureRefs": ["NEGATIVE-FIXTURE-ID"]
      }
    }
  ],
  "negativeFixtures": [
    {
      "id": "NEGATIVE-FIXTURE-ID",
      "path": "path/to/negative-fixture.json",
      "digest": "sha256:0000000000000000000000000000000000000000000000000000000000000000",
      "expectedReasonCode": "expected-reason-code",
      "findingId": "F-000000000000000000000000",
      "receipt": {
        "argv": ["python3", "-I", "-B", ".agents/skills/marshal/references/closure_matrix_negative_fixture.py", "--input", "path/to/negative-fixture.json"],
        "inputDigest": "sha256:0000000000000000000000000000000000000000000000000000000000000000",
        "outputDigest": "sha256:0000000000000000000000000000000000000000000000000000000000000000",
        "exitCode": 1,
        "reasonCode": "expected-reason-code"
      }
    }
  ]
}
